{
  "$schema": "https://json-schema.org/draft/2020-12/schema",
  "$id": "https://github.com/6ilo/firstmate/docs/today-contract/fm-today-snapshot.v1.schema.json",
  "title": "fm-today-snapshot.v1",
  "description": "What the bridge on the captain's machine sends out: the whole fleet as Today shows it. docs/today-contract.md owns the meaning of every field and the privacy rules every string obeys.",
  "type": "object",
  "additionalProperties": false,
  "required": ["schema", "generator_version", "generated_at", "home", "sections"],
  "properties": {
    "schema": { "const": "fm-today-snapshot.v1" },
    "generator_version": { "type": "string", "pattern": "^[0-9]+\\.[0-9]+\\.[0-9]+$" },
    "generated_at": { "$ref": "fm-today-card.v1.schema.json#/$defs/timestamp" },
    "home": { "type": "string", "minLength": 1, "maxLength": 200 },
    "passkeys": { "$ref": "#/$defs/passkeys" },
    "enrolment": { "$ref": "#/$defs/enrolment" },
    "sections": {
      "type": "object",
      "additionalProperties": false,
      "required": ["calls", "underway", "charted_next", "landed", "health", "boards", "day"],
      "properties": {
        "calls": {
          "type": "array",
          "items": { "$ref": "fm-today-card.v1.schema.json" },
          "maxItems": 200
        },
        "underway": {
          "type": "array",
          "items": { "$ref": "#/$defs/underway_row" },
          "maxItems": 1000
        },
        "charted_next": {
          "type": "array",
          "items": { "$ref": "#/$defs/charted_row" },
          "maxItems": 1000
        },
        "landed": { "type": "array", "items": { "$ref": "#/$defs/landed_row" }, "maxItems": 1000 },
        "health": { "$ref": "#/$defs/health" },
        "boards": { "type": "array", "items": { "$ref": "#/$defs/board_row" } },
        "day": { "$ref": "#/$defs/day" }
      }
    }
  },
  "$defs": {
    "task_id": { "$ref": "fm-today-card.v1.schema.json#/$defs/task_id" },
    "repo": { "$ref": "fm-today-card.v1.schema.json#/properties/repo" },
    "owner": { "type": "string", "minLength": 1, "maxLength": 128 },
    "short_text": { "type": "string", "minLength": 1, "maxLength": 200 },
    "size": { "enum": ["S", "M", "L", "XL"] },
    "urgency": { "type": "integer", "minimum": 0, "maximum": 4 },
    "work_type": { "enum": ["ship", "scout", "docs", "fix", "upkeep"] },
    "wait": {
      "type": "object",
      "additionalProperties": false,
      "required": ["kind", "ref"],
      "properties": {
        "kind": { "enum": ["work", "call", "event"] },
        "ref": { "$ref": "#/$defs/ref" },
        "label": { "$ref": "#/$defs/short_text" }
      },
      "allOf": [
        {
          "if": { "properties": { "kind": { "const": "event" } }, "required": ["kind"] },
          "then": { "required": ["label"] }
        }
      ]
    },
    "underway_row": {
      "type": "object",
      "additionalProperties": false,
      "required": ["id", "title", "kind", "state", "doing", "repo"],
      "properties": {
        "id": { "$ref": "#/$defs/task_id" },
        "title": { "$ref": "#/$defs/short_text" },
        "kind": { "type": "string", "pattern": "^[a-z-]{1,32}$" },
        "state": { "type": "string", "pattern": "^[a-z-]{1,32}$" },
        "doing": { "$ref": "#/$defs/short_text" },
        "repo": { "$ref": "#/$defs/repo" },
        "owner": { "$ref": "#/$defs/owner" },
        "size": { "$ref": "#/$defs/size" },
        "urgency": { "$ref": "#/$defs/urgency" },
        "type": { "$ref": "#/$defs/work_type" },
        "waits_on": { "$ref": "#/$defs/waits_on" },
        "pr_url": { "$ref": "fm-today-card.v1.schema.json#/properties/pr_url" }
      }
    },
    "charted_row": {
      "type": "object",
      "additionalProperties": false,
      "required": ["id", "title", "reason", "dispatchable", "repo"],
      "properties": {
        "id": { "$ref": "#/$defs/task_id" },
        "title": { "$ref": "#/$defs/short_text" },
        "reason": { "type": "string", "maxLength": 200 },
        "dispatchable": { "type": "boolean" },
        "kind": { "enum": ["queued", "warning"] },
        "filed": { "$ref": "fm-today-card.v1.schema.json#/$defs/date" },
        "blocked_by": { "type": "array", "items": { "$ref": "#/$defs/task_id" } },
        "repo": { "$ref": "#/$defs/repo" },
        "owner": { "$ref": "#/$defs/owner" },
        "size": { "$ref": "#/$defs/size" },
        "urgency": { "$ref": "#/$defs/urgency" },
        "type": { "$ref": "#/$defs/work_type" },
        "waits_on": { "$ref": "#/$defs/waits_on" },
        "order": { "$ref": "#/$defs/order" },
        "aud": { "enum": ["public", "team", "agents"] },
        "visible": { "type": "boolean" },
        "until": { "$ref": "fm-today-card.v1.schema.json#/$defs/date" },
        "parked": { "type": "boolean" },
        "mockup_url": { "$ref": "fm-today-card.v1.schema.json#/properties/pr_url" }
      },
      "allOf": [
        {
          "if": { "properties": { "kind": { "const": "warning" } }, "required": ["kind"] },
          "then": { "properties": { "dispatchable": { "const": false } } }
        },
        {
          "if": { "required": ["visible"] },
          "then": { "required": ["aud"], "properties": { "aud": { "enum": ["public", "team"] } } }
        },
        {
          "if": { "required": ["mockup_url"] },
          "then": { "required": ["visible"], "properties": { "visible": { "const": true } } }
        }
      ]
    },
    "landed_row": {
      "type": "object",
      "additionalProperties": false,
      "required": ["id", "title", "owner", "repo"],
      "properties": {
        "id": { "$ref": "#/$defs/task_id" },
        "title": { "$ref": "#/$defs/short_text" },
        "owner": { "$ref": "#/$defs/owner" },
        "repo": { "$ref": "#/$defs/repo" },
        "pr_url": { "$ref": "fm-today-card.v1.schema.json#/properties/pr_url" },
        "subject": {
          "type": "object",
          "additionalProperties": false,
          "required": ["artifact", "version"],
          "properties": {
            "artifact": { "type": "string", "pattern": "^[A-Za-z0-9._-]{1,128}$" },
            "version": {
              "type": "string",
              "pattern": "^(0|[1-9][0-9]{0,8})\\.(0|[1-9][0-9]{0,8})\\.(0|[1-9][0-9]{0,8})$"
            }
          }
        },
        "landed_at": { "$ref": "fm-today-card.v1.schema.json#/$defs/timestamp" }
      }
    },
    "health": {
      "type": "object",
      "additionalProperties": false,
      "required": ["supervision", "unhealthy"],
      "properties": {
        "supervision": { "enum": ["live", "lapsed", "unknown"] },
        "unhealthy": {
          "type": "array",
          "items": {
            "type": "object",
            "additionalProperties": false,
            "required": ["id", "endpoint_exists", "agent_alive"],
            "properties": {
              "id": { "type": "string", "pattern": "^[A-Za-z0-9._/-]{1,257}$" },
              "endpoint_exists": { "type": "boolean" },
              "agent_alive": { "type": ["boolean", "null"] }
            }
          }
        }
      }
    },
    "board_row": {
      "type": "object",
      "additionalProperties": false,
      "required": ["owner_task", "state", "round", "last_changed", "link"],
      "properties": {
        "owner_task": { "$ref": "#/$defs/task_id" },
        "state": { "enum": ["listening", "round-open", "owner-gone"] },
        "round": { "type": "integer", "minimum": 0 },
        "last_changed": { "$ref": "fm-today-card.v1.schema.json#/$defs/timestamp" },
        "link": {
          "type": "string",
          "maxLength": 500,
          "pattern": "^https?://[A-Za-z0-9](?:[A-Za-z0-9.-]*[A-Za-z0-9])?(?::[0-9]{1,5})?/[^\\s]*$"
        }
      }
    },
    "day": {
      "type": "object",
      "additionalProperties": false,
      "required": ["date", "ends_at", "blocks"],
      "properties": {
        "date": { "$ref": "fm-today-card.v1.schema.json#/$defs/date" },
        "ends_at": { "$ref": "#/$defs/instant" },
        "blocks": {
          "type": "array",
          "maxItems": 200,
          "items": {
            "type": "object",
            "additionalProperties": false,
            "required": ["id", "title", "starts_at", "ends_at"],
            "properties": {
              "id": { "$ref": "#/$defs/ref" },
              "title": { "$ref": "#/$defs/short_text" },
              "starts_at": { "$ref": "#/$defs/instant" },
              "ends_at": { "$ref": "#/$defs/instant" }
            }
          }
        }
      }
    },
    "ref": { "type": "string", "pattern": "^[A-Za-z0-9._:/-]{1,200}$" },
    "instant": {
      "description": "An instant with an explicit UTC offset, such as 2026-09-28T09:00:00-05:00.",
      "type": "string",
      "pattern": "^[0-9]{4}-(0[1-9]|1[0-2])-(0[1-9]|[12][0-9]|3[01])T([01][0-9]|2[0-3]):[0-5][0-9]:[0-5][0-9](\\.[0-9]{1,6})?(Z|[+-]([01][0-9]|2[0-3]):[0-5][0-9])$"
    },
    "passkeys": {
      "description": "The relying party and the credentials firstmate holds for the captain, which may sign a merge or go answer. Absent when none is enrolled.",
      "type": "object",
      "additionalProperties": false,
      "required": ["rp_id", "origin", "credentials"],
      "properties": {
        "rp_id": { "$ref": "#/$defs/rp_id" },
        "origin": { "$ref": "#/$defs/origin" },
        "credentials": {
          "type": "array",
          "minItems": 1,
          "maxItems": 16,
          "items": {
            "type": "object",
            "additionalProperties": false,
            "required": ["credential_id", "label"],
            "properties": {
              "credential_id": { "$ref": "#/$defs/credential_id" },
              "label": { "type": "string", "minLength": 1, "maxLength": 120 }
            }
          }
        }
      }
    },
    "enrolment": {
      "description": "An enrolment firstmate started on the captain's machine and asks the portal to carry out. Absent when none is open.",
      "type": "object",
      "additionalProperties": false,
      "required": ["enrol_id", "challenge", "rp_id", "origin", "user_handle", "expires_at"],
      "properties": {
        "enrol_id": { "$ref": "#/$defs/enrol_id" },
        "challenge": { "type": "string", "pattern": "^[A-Za-z0-9_-]{43}$" },
        "rp_id": { "$ref": "#/$defs/rp_id" },
        "origin": { "$ref": "#/$defs/origin" },
        "user_handle": { "type": "string", "pattern": "^[A-Za-z0-9_-]{2,86}$" },
        "expires_at": { "$ref": "fm-today-card.v1.schema.json#/$defs/timestamp" }
      }
    },
    "enrol_id": { "type": "string", "pattern": "^[A-Za-z0-9_-]{8,64}$" },
    "rp_id": {
      "type": "string",
      "maxLength": 253,
      "pattern": "^[a-z0-9](?:[a-z0-9-]*[a-z0-9])?(?:\\.[a-z0-9](?:[a-z0-9-]*[a-z0-9])?)*$"
    },
    "origin": {
      "type": "string",
      "maxLength": 300,
      "pattern": "^https://[a-z0-9](?:[a-z0-9.-]*[a-z0-9])?(?::[0-9]{1,5})?$"
    },
    "credential_id": { "type": "string", "pattern": "^[A-Za-z0-9_-]{1,1364}$" },
    "waits_on": { "type": "array", "maxItems": 20, "items": { "$ref": "#/$defs/wait" } },
    "order": { "type": "integer", "minimum": 0, "maximum": 100000 }
  }
}
