{
  "schema": "fm-today-snapshot.v1",
  "generator_version": "1.2.0",
  "generated_at": "2026-09-30T06:36:00Z",
  "home": "fm-today-live.K9wKIt/home",
  "sections": {
    "calls": [
      {
        "schema": "fm-today-card.v1",
        "task_id": "portal-rail-order",
        "owner": "(main)",
        "kind": "decision",
        "title": "Choose the rail order: pick one of two orders",
        "question": "Choose the rail order: pick one of two orders",
        "options": [
          {
            "value": "reconcile",
            "label": "Already settled",
            "hint": "Re-check the latest state, then close this with evidence or keep it open with a note",
            "recommended": false
          }
        ],
        "repo": null,
        "text_check": {
          "verdict": "pass",
          "checker": "fm-today-text-check@1.0.0",
          "checked_at": "2026-09-30T06:36:00Z"
        },
        "card_hash": "9e7c8159da3c18ea8fbd97e728a0486dce2ce18b23676a836ea0657978119645"
      },
      {
        "schema": "fm-today-card.v1",
        "task_id": "kit-order",
        "owner": "(main)",
        "kind": "decision",
        "title": "Choose the kit vendor: vendor A or B",
        "question": "Choose the kit vendor: vendor A or B",
        "options": [
          {
            "value": "reconcile",
            "label": "Already settled",
            "hint": "Re-check the latest state, then close this with evidence or keep it open with a note",
            "recommended": false
          }
        ],
        "repo": null,
        "text_check": {
          "verdict": "pass",
          "checker": "fm-today-text-check@1.0.0",
          "checked_at": "2026-09-30T06:36:00Z"
        },
        "card_hash": "6e1904b4a5fd9e1a41163a5b29ccc68272fcfd94538a7d135210ee30e8c5d9b5"
      }
    ],
    "underway": [],
    "charted_next": [],
    "landed": [],
    "health": {
      "supervision": "unknown",
      "unhealthy": []
    },
    "boards": [],
    "day": {
      "date": "2026-09-30",
      "ends_at": "2026-10-01T00:00:00+00:00",
      "blocks": []
    }
  }
}
