{
  "schema": "fm-today-snapshot.v1",
  "generator_version": "1.2.0",
  "generated_at": "2026-09-30T01:14:52Z",
  "home": "T/fm-lab.lgWqsT",
  "sections": {
    "calls": [
      {
        "schema": "fm-today-card.v1",
        "task_id": "pick-order",
        "owner": "(main)",
        "kind": "decision",
        "title": "Choose subscription order: captain choice pending",
        "question": "Choose subscription order: captain choice pending",
        "options": [
          {
            "value": "reconcile",
            "label": "Reconcile",
            "hint": "Re-check the latest state, then close this with evidence or keep it open with a note",
            "recommended": false
          }
        ],
        "repo": null,
        "text_check": {
          "verdict": "pass",
          "checker": "fm-today-text-check@1.0.0",
          "checked_at": "2026-09-30T01:14:52Z"
        },
        "card_hash": "68f1baa01036c5d65efe3bb087df2b8540ab8008201b3b81420aa069e547edf1"
      },
      {
        "schema": "fm-today-card.v1",
        "task_id": "pick-order",
        "owner": "mate",
        "kind": "decision",
        "title": "Mate chooses release order: captain choice pending",
        "question": "Mate chooses release order: captain choice pending",
        "options": [
          {
            "value": "reconcile",
            "label": "Reconcile",
            "hint": "Re-check the latest state, then close this with evidence or keep it open with a note",
            "recommended": false
          }
        ],
        "repo": null,
        "text_check": {
          "verdict": "pass",
          "checker": "fm-today-text-check@1.0.0",
          "checked_at": "2026-09-30T01:14:52Z"
        },
        "card_hash": "7b61c0b955ca7f4724db870973a8c95454e3d5e9c16f5daa10b281f72e2313d6"
      }
    ],
    "underway": [],
    "charted_next": [
      {
        "id": "shared-work",
        "title": "Main queued work",
        "reason": "",
        "dispatchable": true,
        "kind": "queued",
        "repo": null,
        "owner": "(main)"
      },
      {
        "id": "shared-work",
        "title": "Mate queued work",
        "reason": "",
        "dispatchable": true,
        "kind": "queued",
        "repo": null,
        "owner": "mate"
      }
    ],
    "landed": [],
    "health": {
      "supervision": "unknown",
      "unhealthy": []
    },
    "boards": [],
    "day": {
      "date": "2026-09-29",
      "ends_at": "2026-09-30T00:00:00-05:00",
      "blocks": []
    }
  }
}
