{
  "schema": "fm-today-snapshot.v1",
  "generator_version": "1.2.0",
  "generated_at": "2026-09-29T19:49:48Z",
  "home": "/fm-lab.k1VqWr",
  "sections": {
    "calls": [
      {
        "schema": "fm-today-card.v1",
        "task_id": "launch-week",
        "kind": "decision",
        "title": "Choose the launch week: a second launch question",
        "question": "Choose the launch week: a second launch question",
        "options": [
          {
            "value": "reconcile",
            "label": "Reconcile",
            "hint": "Re-check the latest state, then close this with evidence or keep it open with a note",
            "recommended": false
          }
        ],
        "repo": null,
        "text_check": {
          "verdict": "pass",
          "checker": "fm-today-text-check@1.0.0",
          "checked_at": "2026-09-29T19:49:48Z"
        },
        "card_hash": "33e46b055ce42c330506da60de8dfb93d3c56eacfb1bfc95eed5100b4fd7c991"
      },
      {
        "schema": "fm-today-card.v1",
        "task_id": "pick-venue",
        "kind": "decision",
        "title": "Pick a venue: captain venue choice",
        "question": "Pick a venue: captain venue choice",
        "options": [
          {
            "value": "hall",
            "label": "Town hall",
            "recommended": true
          },
          {
            "value": "reconcile",
            "label": "Reconcile",
            "hint": "Re-check the latest state, then close this with evidence or keep it open with a note",
            "recommended": false
          }
        ],
        "repo": null,
        "text_check": {
          "verdict": "pass",
          "checker": "fm-today-text-check@1.0.0",
          "checked_at": "2026-09-29T19:49:48Z"
        },
        "card_hash": "a4ae3eb2151bc7ee255ba9ee77c9ec75806eee81993700c6e83ed37ac7a6db8d"
      },
      {
        "schema": "fm-today-card.v1",
        "task_id": "pick-supplier",
        "kind": "decision",
        "title": "A call is waiting on the machine",
        "question": "This call's text stays on the machine. Read it there.",
        "options": [
          {
            "value": "north",
            "label": "Option 1",
            "recommended": false,
            "hint": "Text kept on the machine"
          },
          {
            "value": "south",
            "label": "Option 2",
            "recommended": true
          },
          {
            "value": "reconcile",
            "label": "Reconcile",
            "hint": "Re-check the latest state, then close this with evidence or keep it open with a note",
            "recommended": false
          }
        ],
        "repo": null,
        "text_check": {
          "verdict": "withheld",
          "checker": "fm-today-text-check@1.0.0",
          "checked_at": "2026-09-29T19:49:48Z"
        },
        "card_hash": "bec0a9babd3f770e895bfd352379f9c4969ece8cb70ce7853a91a5a84df43767"
      }
    ],
    "underway": [],
    "charted_next": [],
    "landed": [],
    "health": {
      "supervision": "unknown",
      "unhealthy": []
    },
    "boards": [],
    "day": {
      "date": "2026-09-29",
      "ends_at": "2026-09-30T00:00:00-05:00",
      "blocks": []
    }
  }
}
