{
  "schema": "fm-today-snapshot.v1",
  "generator_version": "1.1.0",
  "generated_at": "2026-09-29T19:58:08Z",
  "home": "/fm-lab.JftHJB",
  "sections": {
    "calls": [
      {
        "schema": "fm-today-card.v1",
        "task_id": "rail-order",
        "kind": "decision",
        "title": "Choose the rail order: captain choice pending",
        "question": "Choose the rail order: captain choice pending",
        "options": [
          {
            "value": "reconcile",
            "label": "Reconcile",
            "hint": "Re-check the latest state, then close this with evidence or keep it open with a note",
            "recommended": false
          }
        ],
        "repo": null,
        "text_check": {
          "verdict": "pass",
          "checker": "fm-today-text-check@1.0.0",
          "checked_at": "2026-09-29T19:58:08Z"
        },
        "card_hash": "777645bdfb66c8bfc5d1ab69dcfd012550d6f6a8e38e807bde2d739c362ca86f"
      }
    ],
    "underway": [
      {
        "id": "ship-task",
        "title": "Ship the thing",
        "kind": "ship",
        "state": "working",
        "doing": "harness busy (claude-hook)",
        "repo": null,
        "type": "ship"
      }
    ],
    "charted_next": [
      {
        "id": "live-gate",
        "title": "Main queued work",
        "reason": "",
        "dispatchable": true,
        "kind": "queued",
        "repo": null,
        "owner": "(main)"
      }
    ],
    "landed": [
      {
        "id": "done-a",
        "title": "Main landed thing",
        "owner": "(main)",
        "repo": "6ilo/firstmate",
        "pr_url": "https://github.com/6ilo/firstmate/pull/7"
      }
    ],
    "health": {
      "supervision": "unknown",
      "unhealthy": []
    },
    "boards": [],
    "day": {
      "date": "2026-09-29",
      "ends_at": "2026-09-30T00:00:00-05:00",
      "blocks": []
    }
  }
}
