{
  "schema": "fm-today-snapshot.v1",
  "generator_version": "1.2.0",
  "generated_at": "2026-09-30T01:15:27Z",
  "home": "/fm-lab.EZlM8C",
  "sections": {
    "calls": [
      {
        "schema": "fm-today-card.v1",
        "task_id": "launch-week",
        "kind": "decision",
        "title": "Choose the launch week: due 2026-10-10: which week",
        "question": "Choose the launch week: due 2026-10-10: which week",
        "options": [
          {
            "value": "week-1",
            "label": "First week",
            "hint": "Ships before the review",
            "recommended": true
          },
          {
            "value": "week-2",
            "label": "Second week",
            "recommended": false
          },
          {
            "value": "reconcile",
            "label": "Reconcile",
            "hint": "Re-check the latest state, then close this with evidence or keep it open with a note",
            "recommended": false
          }
        ],
        "repo": null,
        "text_check": {
          "verdict": "pass",
          "checker": "fm-today-text-check@1.0.0",
          "checked_at": "2026-09-30T01:15:27Z"
        },
        "card_hash": "cf25f3fc2c1db025c454d7d2bb6b0484fbede5be844c954bc0e58d387a2b8db4"
      },
      {
        "schema": "fm-today-card.v1",
        "task_id": "pick-venue",
        "kind": "decision",
        "title": "Pick a venue: venue choice",
        "question": "Pick a venue: venue choice",
        "options": [
          {
            "value": "reconcile",
            "label": "Reconcile",
            "hint": "Re-check the latest state, then close this with evidence or keep it open with a note",
            "recommended": false
          }
        ],
        "repo": null,
        "text_check": {
          "verdict": "pass",
          "checker": "fm-today-text-check@1.0.0",
          "checked_at": "2026-09-30T01:15:27Z"
        },
        "card_hash": "d4b5478af7ddf301f4689c84859e70e311817cdb5c638f83d44a51bf4271e3e2"
      }
    ],
    "underway": [],
    "charted_next": [],
    "landed": [],
    "health": {
      "supervision": "unknown",
      "unhealthy": []
    },
    "boards": [],
    "day": {
      "date": "2026-09-29",
      "ends_at": "2026-09-30T00:00:00-05:00",
      "blocks": []
    }
  }
}
