{
  "schema": "fm-today-snapshot.v1",
  "generator_version": "1.2.0",
  "generated_at": "2026-09-29T19:49:07Z",
  "home": "/fm-lab.k1VqWr",
  "sections": {
    "calls": [
      {
        "schema": "fm-today-card.v1",
        "task_id": "launch-week",
        "kind": "decision",
        "title": "Choose the launch week: due 2026-10-05: which week should we launch",
        "question": "Choose the launch week: due 2026-10-05: which week should we launch",
        "options": [
          {
            "value": "week-1",
            "label": "First week",
            "hint": "Ships before the review",
            "recommended": true
          },
          {
            "value": "week-2",
            "label": "Second week",
            "recommended": false
          },
          {
            "value": "reconcile",
            "label": "Reconcile",
            "hint": "Re-check the latest state, then close this with evidence or keep it open with a note",
            "recommended": false
          }
        ],
        "repo": null,
        "text_check": {
          "verdict": "pass",
          "checker": "fm-today-text-check@1.0.0",
          "checked_at": "2026-09-29T19:49:07Z"
        },
        "card_hash": "672b8ff3b62de1af22c253e1d1781ac1683742eb790185d5d38b1e291ed409fa"
      },
      {
        "schema": "fm-today-card.v1",
        "task_id": "pick-venue",
        "kind": "decision",
        "title": "Pick a venue: captain venue choice",
        "question": "Pick a venue: captain venue choice",
        "options": [
          {
            "value": "reconcile",
            "label": "Reconcile",
            "hint": "Re-check the latest state, then close this with evidence or keep it open with a note",
            "recommended": false
          }
        ],
        "repo": null,
        "text_check": {
          "verdict": "pass",
          "checker": "fm-today-text-check@1.0.0",
          "checked_at": "2026-09-29T19:49:07Z"
        },
        "card_hash": "6aeae4501f920d952c4abadf8e4a3723cc00add7d0db6df46aaa1361ee98cf2a"
      }
    ],
    "underway": [],
    "charted_next": [],
    "landed": [],
    "health": {
      "supervision": "unknown",
      "unhealthy": []
    },
    "boards": [],
    "day": {
      "date": "2026-09-29",
      "ends_at": "2026-09-30T00:00:00-05:00",
      "blocks": []
    }
  }
}
