{
  "schema": "fm-today-snapshot.v1",
  "generator_version": "1.2.0",
  "generated_at": "2026-09-29T19:58:32Z",
  "home": "/fm-lab.JftHJB",
  "sections": {
    "calls": [
      {
        "schema": "fm-today-card.v1",
        "task_id": "rail-order",
        "owner": "(main)",
        "kind": "decision",
        "title": "Choose the rail order: captain choice pending",
        "question": "Choose the rail order: captain choice pending",
        "options": [
          {
            "value": "reconcile",
            "label": "Reconcile",
            "hint": "Re-check the latest state, then close this with evidence or keep it open with a note",
            "recommended": false
          }
        ],
        "repo": null,
        "text_check": {
          "verdict": "pass",
          "checker": "fm-today-text-check@1.0.0",
          "checked_at": "2026-09-29T19:58:32Z"
        },
        "card_hash": "19d749dc84439117b40d33382ebcce21ffa83732c44a6e6541842a5ea512f760"
      },
      {
        "schema": "fm-today-card.v1",
        "task_id": "rail-order",
        "owner": "portal-mate",
        "kind": "decision",
        "title": "Choose the portal rail order: captain choice pending",
        "question": "Choose the portal rail order: captain choice pending",
        "options": [
          {
            "value": "reconcile",
            "label": "Reconcile",
            "hint": "Re-check the latest state, then close this with evidence or keep it open with a note",
            "recommended": false
          }
        ],
        "repo": null,
        "text_check": {
          "verdict": "pass",
          "checker": "fm-today-text-check@1.0.0",
          "checked_at": "2026-09-29T19:58:32Z"
        },
        "card_hash": "d270f5ac9ca467b81c16b57a6dee728dd8c8e7463670db36ebd7f7906ec87dd8"
      },
      {
        "schema": "fm-today-card.v1",
        "task_id": "kit-order",
        "owner": "portal-mate",
        "kind": "decision",
        "title": "Choose the kit order: captain choice pending",
        "question": "Choose the kit order: captain choice pending",
        "options": [
          {
            "value": "reconcile",
            "label": "Reconcile",
            "hint": "Re-check the latest state, then close this with evidence or keep it open with a note",
            "recommended": false
          }
        ],
        "repo": null,
        "text_check": {
          "verdict": "pass",
          "checker": "fm-today-text-check@1.0.0",
          "checked_at": "2026-09-29T19:58:32Z"
        },
        "card_hash": "8e6d4a2080b938ebad79305901ea4b7a6709783420a3db59fe384f01f582640f"
      }
    ],
    "underway": [
      {
        "id": "ship-task",
        "title": "Ship the thing",
        "kind": "ship",
        "state": "working",
        "doing": "harness busy (claude-hook)",
        "repo": null,
        "owner": "(main)",
        "type": "ship"
      },
      {
        "id": "ship-task",
        "title": "Ship the thing",
        "kind": "ship",
        "state": "working",
        "doing": "harness busy (claude-hook)",
        "repo": null,
        "owner": "portal-mate",
        "type": "ship"
      }
    ],
    "charted_next": [
      {
        "id": "live-gate",
        "title": "Main queued work",
        "reason": "",
        "dispatchable": true,
        "kind": "queued",
        "repo": null,
        "owner": "(main)"
      },
      {
        "id": "live-gate",
        "title": "Mate queued work",
        "reason": "",
        "dispatchable": true,
        "kind": "queued",
        "repo": null,
        "owner": "portal-mate"
      }
    ],
    "landed": [
      {
        "id": "done-a",
        "title": "Main landed thing",
        "owner": "(main)",
        "repo": "6ilo/firstmate",
        "pr_url": "https://github.com/6ilo/firstmate/pull/7"
      },
      {
        "id": "done-a",
        "title": "Mate landed thing",
        "owner": "portal-mate",
        "repo": "6ilo/firstmate",
        "pr_url": "https://github.com/6ilo/firstmate/pull/8"
      }
    ],
    "health": {
      "supervision": "unknown",
      "unhealthy": []
    },
    "boards": [],
    "day": {
      "date": "2026-09-29",
      "ends_at": "2026-09-30T00:00:00-05:00",
      "blocks": []
    }
  }
}
