{
  "schema": "fm-today-snapshot.v1",
  "generator_version": "1.1.0",
  "generated_at": "2026-09-29T06:49:10Z",
  "home": "fm-today-live.lDCEHP/home-target-snap",
  "sections": {
    "calls": [
      {
        "schema": "fm-today-card.v1",
        "task_id": "call-clean",
        "kind": "decision",
        "title": "Choose the rail order: pick one of two orders",
        "question": "Choose the rail order: pick one of two orders",
        "options": [
          {
            "value": "reconcile",
            "label": "Reconcile",
            "hint": "Re-check the latest state, then close this with evidence or keep it open with a note",
            "recommended": false
          }
        ],
        "repo": null,
        "text_check": {
          "verdict": "pass",
          "checker": "fm-today-text-check@1.0.0",
          "checked_at": "2026-09-29T06:49:10Z"
        },
        "card_hash": "9bff8539b7c3050aa4a760576fe0131cbf30a405723fab76d4e41c613b5c023c"
      },
      {
        "schema": "fm-today-card.v1",
        "task_id": "call-email",
        "kind": "decision",
        "title": "A call is waiting on the machine",
        "question": "This call's text stays on the machine. Read it there.",
        "options": [
          {
            "value": "reconcile",
            "label": "Reconcile",
            "hint": "Re-check the latest state, then close this with evidence or keep it open with a note",
            "recommended": false
          }
        ],
        "repo": null,
        "text_check": {
          "verdict": "withheld",
          "checker": "fm-today-text-check@1.0.0",
          "checked_at": "2026-09-29T06:49:10Z"
        },
        "card_hash": "bbaaba3e9008854e3d23824a31e58e0155e6c0eda5af7604b2fe3e2eda240454"
      }
    ],
    "underway": [
      {
        "id": "ship-task",
        "title": "Ship the thing",
        "kind": "ship",
        "state": "unknown",
        "doing": "backend target gone: firstmate:fm-ship-task",
        "repo": "acme/widget",
        "type": "ship",
        "pr_url": "https://github.com/acme/widget/pull/9"
      }
    ],
    "charted_next": [
      {
        "id": "live-gate",
        "title": "Real queued work",
        "reason": "",
        "dispatchable": false,
        "kind": "queued",
        "blocked_by": [
          "ship-task"
        ],
        "repo": null,
        "owner": "(main)"
      }
    ],
    "landed": [
      {
        "id": "done-a",
        "title": "Landed thing",
        "owner": "(main)",
        "repo": "acme/widget",
        "pr_url": "https://github.com/acme/widget/pull/7"
      }
    ],
    "health": {
      "supervision": "unknown",
      "unhealthy": [
        {
          "id": "ship-task",
          "endpoint_exists": false,
          "agent_alive": null
        }
      ]
    },
    "boards": [],
    "day": {
      "date": "2026-09-29",
      "ends_at": "2026-09-30T00:00:00+00:00",
      "blocks": []
    }
  }
}
