{
  "schema": "fm-today-snapshot.v1",
  "generator_version": "1.4.0",
  "generated_at": "2026-10-01T07:32:09Z",
  "home": "firstmate",
  "passkeys": {
    "rp_id": "relay-api.mmeg.us",
    "origin": "https://relay-api.mmeg.us",
    "credentials": [
      {
        "credential_id": "-a0-mGzWrrb8xHU1u_Xhh6ilaAM",
        "label": "iPhone passkey"
      }
    ]
  },
  "sections": {
    "calls": [
      {
        "schema": "fm-today-card.v1",
        "task_id": "m-fix",
        "owner": "(main)",
        "kind": "merge",
        "title": "Merge the widget fix",
        "question": "Merge the widget fix",
        "options": [
          {
            "value": "merge",
            "label": "Merge",
            "hint": "Merge this pull request once its checks are green",
            "recommended": true
          }
        ],
        "repo": "acme/widget",
        "pr_url": "https://github.com/acme/widget/pull/9",
        "head_sha": "aaaaaaaaaaaaaaaaaaaaaaaaaaaaaaaaaaaaaaaa",
        "proof": {
          "nonce": "OprLWZBYhP4q1KX6F6InIA",
          "expires_at": "2026-10-02T07:32:11Z"
        },
        "text_check": {
          "verdict": "pass",
          "checker": "fm-today-text-check@1.0.0",
          "checked_at": "2026-10-01T07:32:09Z"
        },
        "card_hash": "245e94743f3b7201981ab6afc378a72b8492a191dcceb90a8afc3739205bc8d6"
      },
      {
        "schema": "fm-today-card.v1",
        "task_id": "g-build",
        "owner": "(main)",
        "kind": "go",
        "title": "Build the kit page",
        "question": "Build the kit page",
        "options": [
          {
            "value": "go",
            "label": "Go",
            "hint": "Start building",
            "recommended": true
          }
        ],
        "repo": null,
        "subject_sha256": "86fb3ad60a6a9e4304779b014833cbcce3af508f0be52e5ab4ba9b25431b6082",
        "proof": {
          "nonce": "VaNlFoUaW-n3qJOQV3P0Lg",
          "expires_at": "2026-10-02T07:32:13Z"
        },
        "text_check": {
          "verdict": "pass",
          "checker": "fm-today-text-check@1.0.0",
          "checked_at": "2026-10-01T07:32:09Z"
        },
        "card_hash": "bf71c569e9c7efb27de4ccf5d2eb511f42bfb682e8edb18e7a4c12d87d6cb08e"
      }
    ],
    "underway": [],
    "charted_next": [],
    "landed": [],
    "health": {
      "supervision": "unknown",
      "unhealthy": []
    },
    "boards": [],
    "day": {
      "date": "2026-10-01",
      "ends_at": "2026-10-02T00:00:00+00:00",
      "blocks": []
    }
  }
}
