{
  "schema": "fm-today-snapshot.v1",
  "generator_version": "1.2.0",
  "generated_at": "2026-10-01T00:26:42Z",
  "home": "/fm-lab.D0Y0aK",
  "sections": {
    "calls": [
      {
        "schema": "fm-today-card.v1",
        "task_id": "launch-week",
        "owner": "(main)",
        "kind": "decision",
        "title": "Choose the launch week: due 2026-10-05: which week",
        "question": "Choose the launch week: due 2026-10-05: which week",
        "options": [
          {
            "value": "week-1",
            "label": "First week",
            "hint": "Ships before the review",
            "recommended": true
          },
          {
            "value": "week-2",
            "label": "Second week",
            "recommended": false
          },
          {
            "value": "reconcile",
            "label": "Already settled",
            "hint": "Re-check the latest state, then close this with evidence or keep it open with a note",
            "recommended": false
          }
        ],
        "repo": null,
        "text_check": {
          "verdict": "pass",
          "checker": "fm-today-text-check@1.0.0",
          "checked_at": "2026-10-01T00:26:42Z"
        },
        "card_hash": "877b4951e88b12c2ed1370cacbec9e9256a8774855799c9be2ead682f8be5142"
      },
      {
        "schema": "fm-today-card.v1",
        "task_id": "pick-venue",
        "owner": "(main)",
        "kind": "decision",
        "title": "Pick a venue: venue choice",
        "question": "Pick a venue: venue choice",
        "options": [
          {
            "value": "reconcile",
            "label": "Already settled",
            "hint": "Re-check the latest state, then close this with evidence or keep it open with a note",
            "recommended": false
          }
        ],
        "repo": null,
        "text_check": {
          "verdict": "pass",
          "checker": "fm-today-text-check@1.0.0",
          "checked_at": "2026-10-01T00:26:42Z"
        },
        "card_hash": "c057c5af78116ddaa4f6cdb6b1a5b3adbc13ba063cb486b7a4c1c7910d9adfa6"
      },
      {
        "schema": "fm-today-card.v1",
        "task_id": "pick-supplier",
        "owner": "(main)",
        "kind": "decision",
        "title": "A call is waiting on the machine",
        "question": "This call's text stays on the machine. Read it there.",
        "options": [
          {
            "value": "north",
            "label": "Option 1",
            "recommended": false,
            "hint": "Text kept on the machine"
          },
          {
            "value": "south",
            "label": "Option 2",
            "recommended": true
          },
          {
            "value": "reconcile",
            "label": "Already settled",
            "hint": "Re-check the latest state, then close this with evidence or keep it open with a note",
            "recommended": false
          }
        ],
        "repo": null,
        "text_check": {
          "verdict": "withheld",
          "checker": "fm-today-text-check@1.0.0",
          "checked_at": "2026-10-01T00:26:42Z"
        },
        "card_hash": "0c7f8d64c203743a4b6aef925fb003f255c62252badfdb98ad6fe955ff4fb1d9"
      }
    ],
    "underway": [],
    "charted_next": [],
    "landed": [],
    "health": {
      "supervision": "unknown",
      "unhealthy": []
    },
    "boards": [],
    "day": {
      "date": "2026-09-30",
      "ends_at": "2026-10-01T00:00:00-05:00",
      "blocks": []
    }
  }
}
