{
  "schema": "fm-today-snapshot.v1",
  "generator_version": "1.3.0",
  "generated_at": "2026-10-01T03:20:42Z",
  "home": "/fm-livehome4.5pR3IO",
  "sections": {
    "calls": [
      {
        "schema": "fm-today-card.v1",
        "task_id": "call-options",
        "owner": "(main)",
        "kind": "decision",
        "title": "Choose the launch week: due 2026-07-20: which week",
        "question": "Choose the launch week: due 2026-07-20: which week",
        "options": [
          {
            "value": "week-1",
            "label": "First week",
            "hint": "Ships before the review",
            "recommended": true
          },
          {
            "value": "week-2",
            "label": "Second week",
            "recommended": false
          },
          {
            "value": "reconcile",
            "label": "Already settled",
            "hint": "Re-check the latest state, then close this with evidence or keep it open with a note",
            "recommended": false
          }
        ],
        "repo": null,
        "text_check": {
          "verdict": "pass",
          "checker": "fm-today-text-check@1.0.0",
          "checked_at": "2026-10-01T03:20:42Z"
        },
        "card_hash": "260d59a28d68d2eb4d17683e9acaf142bd36631b1fd368fe066f6b18cb5f3061"
      }
    ],
    "underway": [],
    "charted_next": [],
    "landed": [],
    "health": {
      "supervision": "unknown",
      "unhealthy": []
    },
    "boards": [],
    "day": {
      "date": "2026-10-01",
      "ends_at": "2026-10-02T00:00:00+00:00",
      "blocks": []
    }
  }
}
